{
  "schema": "dynamic_functional_mlds_v2_instance",
  "id": "DFM-BESTFIT_CAREER_FAIR",
  "metamodelVersion": "2.0.0-model",
  "serializationVersion": "1.0",
  "caseId": "bestfit_career_fair",
  "profile": "executable",
  "fixture_profile": "executable",
  "sourceContract": {
    "schema": "functionalmlds_case_study",
    "metamodelVersion": "v0.5",
    "semanticProjectionSha256": "e75ff465c5312ac32bd51059c74c45877f0cb180eb03262941ee75852fac2c9b"
  },
  "objects": [
    {
      "id": "DFM-BESTFIT_CAREER_FAIR",
      "type": "DynamicFunctionalModel",
      "requirementsModel": [
        "RM-BESTFIT_CAREER_FAIR"
      ],
      "verificationValidation": [
        "VV-BESTFIT_CAREER_FAIR"
      ],
      "actor": [
        "ACT-CASE-STUDY-ENGINEER",
        "ACT-VISITOR",
        "ACT-ROOM-GUIDE"
      ],
      "scenario": [
        "SC-BESTFIT_CAREER_FAIR-MAIN"
      ],
      "scenarioEvent": [
        "EV-BESTFIT_CAREER_FAIR-MLDS-PROVIDED",
        "EV-BESTFIT_CAREER_FAIR-VISITOR-QUESTION",
        "EV-BESTFIT_CAREER_FAIR-HANDOFF-NEEDED"
      ],
      "scenarioCondition": [
        "COND-BESTFIT_CAREER_FAIR-VALID-INPUT",
        "COND-BESTFIT_CAREER_FAIR-AGENTS-AVAILABLE",
        "COND-BESTFIT_CAREER_FAIR-HANDOFF-TARGET-AVAILABLE"
      ],
      "assertion": [
        "SA-BESTFIT_CAREER_FAIR-NORMALIZED-SCENE-VALID",
        "SA-BESTFIT_CAREER_FAIR-SCENE-SEMANTICS-VALID",
        "SA-BESTFIT_CAREER_FAIR-AGENT-ROLES-VALID",
        "SA-BESTFIT_CAREER_FAIR-KNOWLEDGE-VALID",
        "SA-BESTFIT_CAREER_FAIR-PLACEMENT-VALID",
        "SA-BESTFIT_CAREER_FAIR-FUNCTIONALMLDS-VALID",
        "SA-BESTFIT_CAREER_FAIR-PROJECT-MATERIALIZED",
        "SA-BESTFIT_CAREER_FAIR-SETUP-VALID",
        "SA-BESTFIT_CAREER_FAIR-ANSWER-GROUNDED",
        "SA-BESTFIT_CAREER_FAIR-HANDOFF-VALID",
        "AST-BESTFIT_CAREER_FAIR-DERIVED-EVENT",
        "AST-BESTFIT_CAREER_FAIR-DERIVED-OUTPUT",
        "AST-BESTFIT_CAREER_FAIR-DERIVED-GROUNDING",
        "AST-BESTFIT_CAREER_FAIR-DERIVED-RELATION"
      ],
      "entity": [
        "ENT-ZONE-RECEPTION_ZONE",
        "ENT-ZONE-SHOWCASE_ZONE",
        "ENT-ZONE-BENEFITS_INFO_ZONE",
        "ENT-ZONE-RECRUITING_ZONE",
        "ENT-ZONE-DEMO_KIOSK_ZONE",
        "ENT-ZONE-REFRESHMENT_ZONE",
        "ENT-GROUP-DEMO_KIOSKS",
        "ENT-GROUP-KIOSKS",
        "ENT-GROUP-LOUNGE",
        "ENT-GROUP-PANELS",
        "ENT-GROUP-RECEPTION",
        "ENT-GROUP-RECRUITING",
        "ENT-GROUP-REFRESHMENT",
        "ENT-GROUP-SHOWCASE",
        "ENT-GROUP-STELES",
        "ENT-GROUP-STOOLS",
        "ENT-GROUP-TERMINALS",
        "ENT-GROUP-VR_STATIONS",
        "ENT-ASSET-BAR_STOOL_REFRESHMENT1",
        "ENT-ASSET-BAR_STOOL_REFRESHMENT2",
        "ENT-ASSET-BAR_STOOL_REFRESHMENT3",
        "ENT-ASSET-BENEFITS_PANEL1",
        "ENT-ASSET-BENEFITS_PANEL2",
        "ENT-ASSET-BENEFITS_PANEL3",
        "ENT-ASSET-CHAIR_RECRUITING",
        "ENT-ASSET-INFO_STELE_STUDIO1",
        "ENT-ASSET-INFO_STELE_STUDIO2",
        "ENT-ASSET-INFO_STELE_STUDIO3",
        "ENT-ASSET-INTERACTIVE_TERMINAL_BENEFITS1",
        "ENT-ASSET-INTERACTIVE_TERMINAL_BENEFITS2",
        "ENT-ASSET-KIOSK_DEMO1",
        "ENT-ASSET-KIOSK_DEMO2",
        "ENT-ASSET-KIOSK_DEMO3",
        "ENT-ASSET-KIOSK_RECEPTION",
        "ENT-ASSET-LOUNGE_SEATING",
        "ENT-ASSET-POSTER_RECRUITING1",
        "ENT-ASSET-POSTER_RECRUITING2",
        "ENT-ASSET-REFRESHMENT_COUNTER",
        "ENT-ASSET-SHOWCASE_EQUIPMENT_TREADMILL",
        "ENT-ASSET-SHOWCASE_EQUIPMENT_WEIGHTS_RACK",
        "ENT-ASSET-TOTEM_RECEPTION",
        "ENT-ASSET-TOUCH_TERMINAL_RECRUITING1",
        "ENT-ASSET-TOUCH_TERMINAL_RECRUITING2",
        "ENT-ASSET-VR_AR_STATION1",
        "ENT-ASSET-VR_AR_STATION2",
        "ENT-AGENT-RECEPTION_AGENT",
        "ENT-AGENT-BENEFITS_EXPERT",
        "ENT-AGENT-RECRUITING_AGENT",
        "ENT-AGENT-DEMO_TECHNICIAN",
        "ENT-AGENT-HOSPITALITY_AGENT",
        "ENT-STATE-BESTFIT_CAREER_FAIR",
        "ENT-BESTFIT_CAREER_FAIR-RUNTIME-ORCHESTRATOR"
      ],
      "capability": [
        "CAP-BESTFIT_CAREER_FAIR-ANALYZE-MLDS-SCENE",
        "CAP-BESTFIT_CAREER_FAIR-DERIVE-SPATIAL-AGENT-ROLES",
        "CAP-BESTFIT_CAREER_FAIR-GENERATE-ROOM-KNOWLEDGE",
        "CAP-BESTFIT_CAREER_FAIR-PLACE-AGENTS-IN-SCENE",
        "CAP-BESTFIT_CAREER_FAIR-ASSEMBLE-FUNCTIONAL-MLDS",
        "CAP-BESTFIT_CAREER_FAIR-MATERIALIZE-INTERACTIVE-AGENTS-PROJECT",
        "CAP-BESTFIT_CAREER_FAIR-SETUP-INTERACTIVE-SESSION",
        "CAP-BESTFIT_CAREER_FAIR-ANSWER-ROOM-GROUNDED-QUESTION",
        "CAP-BESTFIT_CAREER_FAIR-HANDOFF-TO-RESPONSIBLE-AGENT"
      ],
      "runtimeBinding": [
        "RB-BESTFIT_CAREER_FAIR-ANALYZE-MLDS-SCENE",
        "RB-BESTFIT_CAREER_FAIR-DERIVE-SPATIAL-AGENT-ROLES",
        "RB-BESTFIT_CAREER_FAIR-GENERATE-ROOM-KNOWLEDGE",
        "RB-BESTFIT_CAREER_FAIR-PLACE-AGENTS-IN-SCENE",
        "RB-BESTFIT_CAREER_FAIR-ASSEMBLE-FUNCTIONAL-MLDS",
        "RB-BESTFIT_CAREER_FAIR-MATERIALIZE-INTERACTIVE-AGENTS-PROJECT",
        "RB-BESTFIT_CAREER_FAIR-SETUP-INTERACTIVE-SESSION",
        "RB-BESTFIT_CAREER_FAIR-ANSWER-ROOM-GROUNDED-QUESTION",
        "RB-BESTFIT_CAREER_FAIR-HANDOFF-TO-RESPONSIBLE-AGENT"
      ],
      "ownedRelationship": [
        "UC-BESTFIT_CAREER_FAIR-01-ACTOR-1",
        "UC-BESTFIT_CAREER_FAIR-01-ACTOR-2",
        "UC-BESTFIT_CAREER_FAIR-01-ACTOR-3",
        "UC-BESTFIT_CAREER_FAIR-01-SPEC-SC-BESTFIT_CAREER_FAIR-MAIN",
        "SAT-REQ-BESTFIT_CAREER_FAIR-001",
        "SAT-REQ-BESTFIT_CAREER_FAIR-002",
        "SAT-REQ-BESTFIT_CAREER_FAIR-003",
        "SAT-REQ-BESTFIT_CAREER_FAIR-004",
        "SAT-REQ-BESTFIT_CAREER_FAIR-005",
        "SAT-REQ-BESTFIT_CAREER_FAIR-006",
        "VC-BESTFIT_CAREER_FAIR-MLDS-INGESTION-USECASE-1",
        "VC-BESTFIT_CAREER_FAIR-MODEL-INVARIANTS-USECASE-1",
        "VC-BESTFIT_CAREER_FAIR-PROJECT-MATERIALIZATION-USECASE-1",
        "VC-BESTFIT_CAREER_FAIR-SETUP-USECASE-1",
        "VC-BESTFIT_CAREER_FAIR-CHAT-GROUNDING-USECASE-1",
        "VC-BESTFIT_CAREER_FAIR-HANDOFF-USECASE-1"
      ]
    },
    {
      "id": "REQ-BESTFIT_CAREER_FAIR-001",
      "type": "Requirement",
      "text": "The pipeline shall ingest an MLDS scene and preserve stable object identities."
    },
    {
      "id": "REQ-BESTFIT_CAREER_FAIR-002",
      "type": "Requirement",
      "text": "The pipeline shall derive room semantics grounded in existing MLDS objects."
    },
    {
      "id": "REQ-BESTFIT_CAREER_FAIR-003",
      "type": "Requirement",
      "text": "The pipeline shall synthesize backend-compatible spatial agent roles."
    },
    {
      "id": "REQ-BESTFIT_CAREER_FAIR-004",
      "type": "Requirement",
      "text": "Every generated agent knowledge tag shall be covered by materialized knowledge."
    },
    {
      "id": "REQ-BESTFIT_CAREER_FAIR-005",
      "type": "Requirement",
      "text": "Every generated agent shall be placed inside the room without obstacle overlap."
    },
    {
      "id": "REQ-BESTFIT_CAREER_FAIR-006",
      "type": "Requirement",
      "text": "The generated behavior shall be traceable from requirements to runtime actions and validation cases."
    },
    {
      "id": "UC-BESTFIT_CAREER_FAIR-01",
      "type": "UseCase",
      "extensionPoint": [],
      "include": [],
      "extend": [],
      "name": "Generate and use spatially grounded multi-agent guide"
    },
    {
      "id": "RM-BESTFIT_CAREER_FAIR",
      "type": "RequirementsModel",
      "requirement": [
        "REQ-BESTFIT_CAREER_FAIR-001",
        "REQ-BESTFIT_CAREER_FAIR-002",
        "REQ-BESTFIT_CAREER_FAIR-003",
        "REQ-BESTFIT_CAREER_FAIR-004",
        "REQ-BESTFIT_CAREER_FAIR-005",
        "REQ-BESTFIT_CAREER_FAIR-006"
      ],
      "useCase": [
        "UC-BESTFIT_CAREER_FAIR-01"
      ]
    },
    {
      "id": "ACT-CASE-STUDY-ENGINEER",
      "type": "Actor",
      "name": "Case Study Engineer",
      "text": "Provides MLDS input and runs the validation pipeline."
    },
    {
      "id": "ACT-VISITOR",
      "type": "Actor",
      "name": "Visitor",
      "text": "Asks room-related questions in the generated immersive environment."
    },
    {
      "id": "ACT-ROOM-GUIDE",
      "type": "Actor",
      "name": "Room Guide",
      "text": "Role played by generated interactive agents."
    },
    {
      "id": "ENT-ZONE-RECEPTION_ZONE",
      "type": "Entity",
      "name": "Reception and Welcome Area",
      "kind": "zone",
      "sourceId": "reception_zone",
      "entityRole": "semanticZone",
      "sourceObjectId": [
        "totem_reception",
        "kiosk_reception"
      ],
      "purpose": "Initial visitor greeting and orientation with branding and basic info."
    },
    {
      "id": "ENT-ZONE-SHOWCASE_ZONE",
      "type": "Entity",
      "name": "Product Showcase Area",
      "kind": "zone",
      "sourceId": "showcase_zone",
      "entityRole": "semanticZone",
      "sourceObjectId": [
        "showcase_equipment_treadmill",
        "showcase_equipment_weights_rack",
        "vr_ar_station1",
        "vr_ar_station2",
        "info_stele_studio1",
        "info_stele_studio2",
        "info_stele_studio3"
      ],
      "purpose": "Display and demonstration of company products and technologies to attract interest."
    },
    {
      "id": "ENT-ZONE-BENEFITS_INFO_ZONE",
      "type": "Entity",
      "name": "Company Benefits Information Zone",
      "kind": "zone",
      "sourceId": "benefits_info_zone",
      "entityRole": "semanticZone",
      "sourceObjectId": [
        "benefits_panel1",
        "benefits_panel2",
        "benefits_panel3",
        "interactive_terminal_benefits1",
        "interactive_terminal_benefits2"
      ],
      "purpose": "Provide detailed information about employee benefits and company values via panels and interactive terminals."
    },
    {
      "id": "ENT-ZONE-RECRUITING_ZONE",
      "type": "Entity",
      "name": "Recruiting and Job Application Area",
      "kind": "zone",
      "sourceId": "recruiting_zone",
      "entityRole": "semanticZone",